{
  "options": [],
  "subject": "example-value",
  "body": "example-value",
  "defaults": "example-value",
  "multiple": true,
  "params": {},
  "assigned_users": [],
  "created_at": "2026-01-15T10:30:00Z",
  "responded_by_user": "example-value",
  "responded_at": "example-value",
  "chosen_options": "example-value",
  "params_input": {},
  "response_received": true,
  "task_instance": "example-value"
}